{
  "schema_version": "2.0.0",
  "resource": {
    "profile": "administrative_action",
    "owner_module": "audit",
    "resource_kind": "administrative_action",
    "resource_id": "action-local-policy-001",
    "identity": {
      "action_id": "action-local-policy-001",
      "policy_id": "local-access-policy",
      "policy_version": "1.0.0",
      "action_at": "2026-10-18T08:00:00Z",
      "occurrence": 1
    },
    "integrity_digest": "aaaaaaaaaaaaaaaaaaaaaaaaaaaaaaaaaaaaaaaaaaaaaaaaaaaaaaaaaaaaaaaa",
    "recorded_at": "2026-10-18T08:00:01Z",
    "provenance_label": "administrative",
    "validation_status": "validated"
  },
  "producer": {
    "producer_id": "audit-reference-adapter",
    "producer_version": "2.0.0"
  },
  "sources": []
}
