{
  "schema_version": "2.0.0",
  "resource": {
    "profile": "simulation_result",
    "owner_module": "portfolio",
    "resource_kind": "simulation_result",
    "resource_id": "simulation-scenario-001",
    "identity": {
      "simulation_id": "simulation-scenario-001",
      "method_id": "scenario-engine",
      "method_version": "1.0.0",
      "as_of": "2026-10-18T00:00:00Z",
      "occurrence": 1
    },
    "integrity_digest": "2222222222222222222222222222222222222222222222222222222222222222",
    "recorded_at": "2026-10-18T08:05:00Z",
    "provenance_label": "simulated",
    "validation_status": "validated"
  },
  "producer": {
    "producer_id": "synthetic-simulation-adapter",
    "producer_version": "2.0.0"
  },
  "sources": [
    {
      "relation": "simulated_from",
      "reference": {
        "profile": "market_observation",
        "owner_module": "market_data",
        "resource_kind": "market_observation",
        "resource_id": "f9d62cde1cd9c26904372b9dd201ed869126572baacde796f3bfc543cd45a77a",
        "identity": {
          "instrument_id": "instrument-index-demo",
          "observed_at": "2026-10-18T00:00:00Z",
          "method_id": "close-observation",
          "method_version": "1.0.0",
          "source_set_digest": "4444444444444444444444444444444444444444444444444444444444444444"
        },
        "integrity_digest": "dddddddddddddddddddddddddddddddddddddddddddddddddddddddddddddddd",
        "recorded_at": "2026-10-18T00:00:00Z",
        "provenance_label": "observed",
        "validation_status": "validated"
      }
    }
  ]
}
